{
  "$schema": "https://json-schema.org/draft/2020-12/schema",
  "$id": "https://www.theservicemarketingguys.com/standards/open-service-profile/v0.1/manifest.schema.json",
  "title": "Open Service Profile manifest v0.1",
  "type": "object",
  "additionalProperties": true,
  "required": [
    "specVersion",
    "updatedAt",
    "business",
    "locations",
    "services",
    "bookingPolicy",
    "bookingSemantics",
    "interfaces"
  ],
  "if": {
    "properties": {
      "business": {
        "properties": {
          "serviceModel": {
            "enum": [
              "on_site",
              "both"
            ]
          }
        }
      }
    }
  },
  "then": {
    "required": [
      "coverage"
    ]
  },
  "properties": {
    "specVersion": {
      "type": "string",
      "const": "0.1"
    },
    "updatedAt": {
      "type": "string",
      "format": "date-time"
    },
    "conformance": {
      "type": "object",
      "properties": {
        "level": {
          "type": "integer",
          "minimum": 1,
          "maximum": 3
        }
      },
      "required": [
        "level"
      ]
    },
    "business": {
      "$ref": "#/$defs/Business"
    },
    "locations": {
      "type": "array",
      "minItems": 1,
      "items": {
        "$ref": "#/$defs/Location"
      }
    },
    "services": {
      "type": "array",
      "minItems": 1,
      "items": {
        "$ref": "#/$defs/Service"
      }
    },
    "coverage": {
      "$ref": "#/$defs/Coverage"
    },
    "certifications": {
      "type": "array",
      "items": {
        "type": "string",
        "minLength": 1,
        "maxLength": 120
      }
    },
    "bookingPolicy": {
      "$ref": "#/$defs/BookingPolicy"
    },
    "bookingSemantics": {
      "type": "string",
      "const": "request"
    },
    "interfaces": {
      "$ref": "#/$defs/Interfaces"
    },
    "extensions": {
      "type": "object",
      "propertyNames": {
        "pattern": "^[a-z0-9-]+(\\.[a-z0-9-]+)+$"
      }
    }
  },
  "$defs": {
    "Slug": {
      "type": "string",
      "pattern": "^[a-z0-9][a-z0-9-]*$",
      "maxLength": 80
    },
    "Url": {
      "type": "string",
      "format": "uri",
      "pattern": "^https://"
    },
    "Time": {
      "type": "string",
      "pattern": "^([01]\\d|2[0-3]):[0-5]\\d$"
    },
    "CalendarDate": {
      "type": "string",
      "pattern": "^\\d{4}-\\d{2}-\\d{2}$"
    },
    "Zip": {
      "type": "string",
      "pattern": "^\\d{5}$"
    },
    "ServiceModel": {
      "type": "string",
      "enum": [
        "on_site",
        "in_shop",
        "both"
      ]
    },
    "ContactMethod": {
      "type": "string",
      "enum": [
        "call",
        "text",
        "email"
      ]
    },
    "Business": {
      "type": "object",
      "required": [
        "displayName",
        "trades",
        "serviceModel",
        "websiteUrl",
        "phone",
        "timeZone"
      ],
      "properties": {
        "displayName": {
          "type": "string",
          "minLength": 1,
          "maxLength": 120
        },
        "legalName": {
          "type": "string",
          "minLength": 1,
          "maxLength": 200
        },
        "trades": {
          "type": "array",
          "minItems": 1,
          "maxItems": 5,
          "uniqueItems": true,
          "items": {
            "type": "string",
            "minLength": 1,
            "maxLength": 60
          }
        },
        "serviceModel": {
          "$ref": "#/$defs/ServiceModel"
        },
        "parentOrganization": {
          "type": "object",
          "required": [
            "name",
            "url"
          ],
          "properties": {
            "name": {
              "type": "string",
              "minLength": 1,
              "maxLength": 200
            },
            "url": {
              "$ref": "#/$defs/Url"
            }
          }
        },
        "reviewProfiles": {
          "type": "array",
          "maxItems": 10,
          "uniqueItems": true,
          "items": {
            "$ref": "#/$defs/Url"
          }
        },
        "description": {
          "type": "string",
          "maxLength": 600
        },
        "websiteUrl": {
          "$ref": "#/$defs/Url"
        },
        "phone": {
          "type": "string",
          "minLength": 7,
          "maxLength": 40
        },
        "email": {
          "type": "string",
          "format": "email",
          "maxLength": 254
        },
        "yearsInBusiness": {
          "type": "integer",
          "minimum": 0,
          "maximum": 200
        },
        "timeZone": {
          "type": "string",
          "minLength": 1
        }
      }
    },
    "Address": {
      "type": "object",
      "required": [
        "street",
        "city",
        "region",
        "postalCode",
        "country"
      ],
      "properties": {
        "street": {
          "type": "string",
          "minLength": 1,
          "maxLength": 200
        },
        "city": {
          "type": "string",
          "minLength": 1,
          "maxLength": 100
        },
        "region": {
          "type": "string",
          "pattern": "^[A-Z]{2}$"
        },
        "postalCode": {
          "$ref": "#/$defs/Zip"
        },
        "country": {
          "type": "string",
          "const": "US"
        }
      }
    },
    "DayHours": {
      "oneOf": [
        {
          "type": "string",
          "enum": [
            "closed",
            "24_hours"
          ]
        },
        {
          "type": "object",
          "required": [
            "open",
            "close"
          ],
          "properties": {
            "open": {
              "$ref": "#/$defs/Time"
            },
            "close": {
              "$ref": "#/$defs/Time"
            }
          }
        }
      ]
    },
    "Hours": {
      "type": "object",
      "required": [
        "weekly"
      ],
      "properties": {
        "weekly": {
          "type": "object",
          "required": [
            "monday",
            "tuesday",
            "wednesday",
            "thursday",
            "friday",
            "saturday",
            "sunday"
          ],
          "properties": {
            "monday": {
              "$ref": "#/$defs/DayHours"
            },
            "tuesday": {
              "$ref": "#/$defs/DayHours"
            },
            "wednesday": {
              "$ref": "#/$defs/DayHours"
            },
            "thursday": {
              "$ref": "#/$defs/DayHours"
            },
            "friday": {
              "$ref": "#/$defs/DayHours"
            },
            "saturday": {
              "$ref": "#/$defs/DayHours"
            },
            "sunday": {
              "$ref": "#/$defs/DayHours"
            }
          }
        },
        "exceptions": {
          "type": "array",
          "items": {
            "type": "object",
            "required": [
              "date"
            ],
            "properties": {
              "date": {
                "$ref": "#/$defs/CalendarDate"
              },
              "status": {
                "type": "string",
                "const": "closed"
              },
              "open": {
                "$ref": "#/$defs/Time"
              },
              "close": {
                "$ref": "#/$defs/Time"
              },
              "label": {
                "type": "string",
                "maxLength": 80
              }
            },
            "oneOf": [
              {
                "required": [
                  "status"
                ]
              },
              {
                "required": [
                  "open",
                  "close"
                ]
              }
            ]
          }
        },
        "note": {
          "type": "string",
          "maxLength": 200
        }
      }
    },
    "Location": {
      "type": "object",
      "required": [
        "id",
        "name",
        "isPrimary",
        "address",
        "hours"
      ],
      "properties": {
        "id": {
          "$ref": "#/$defs/Slug"
        },
        "name": {
          "type": "string",
          "minLength": 1,
          "maxLength": 120
        },
        "isPrimary": {
          "type": "boolean"
        },
        "address": {
          "$ref": "#/$defs/Address"
        },
        "geo": {
          "type": "object",
          "required": [
            "latitude",
            "longitude"
          ],
          "properties": {
            "latitude": {
              "type": "number",
              "minimum": -90,
              "maximum": 90
            },
            "longitude": {
              "type": "number",
              "minimum": -180,
              "maximum": 180
            }
          }
        },
        "phone": {
          "type": "string",
          "minLength": 7,
          "maxLength": 40
        },
        "email": {
          "type": "string",
          "format": "email",
          "maxLength": 254
        },
        "hours": {
          "$ref": "#/$defs/Hours"
        },
        "pageUrl": {
          "$ref": "#/$defs/Url"
        },
        "acceptsWalkIns": {
          "type": "boolean"
        }
      }
    },
    "Service": {
      "type": "object",
      "required": [
        "slug",
        "name"
      ],
      "properties": {
        "slug": {
          "$ref": "#/$defs/Slug"
        },
        "name": {
          "type": "string",
          "minLength": 1,
          "maxLength": 120
        },
        "category": {
          "$ref": "#/$defs/Slug"
        },
        "description": {
          "type": "string",
          "maxLength": 600
        },
        "url": {
          "$ref": "#/$defs/Url"
        },
        "pricePresentation": {
          "type": "string",
          "maxLength": 120
        },
        "bookable": {
          "type": "boolean",
          "default": true
        },
        "locationIds": {
          "type": "array",
          "items": {
            "$ref": "#/$defs/Slug"
          },
          "uniqueItems": true
        }
      }
    },
    "Coverage": {
      "type": "object",
      "anyOf": [
        {
          "required": [
            "postalCodes"
          ]
        },
        {
          "required": [
            "radius"
          ]
        }
      ],
      "properties": {
        "postalCodes": {
          "type": "array",
          "minItems": 1,
          "uniqueItems": true,
          "items": {
            "$ref": "#/$defs/Zip"
          }
        },
        "radius": {
          "type": "array",
          "minItems": 1,
          "items": {
            "type": "object",
            "required": [
              "locationId",
              "miles"
            ],
            "properties": {
              "locationId": {
                "$ref": "#/$defs/Slug"
              },
              "miles": {
                "type": "number",
                "exclusiveMinimum": 0,
                "maximum": 500
              }
            }
          }
        },
        "areaNames": {
          "type": "array",
          "items": {
            "type": "string",
            "maxLength": 100
          }
        },
        "note": {
          "type": "string",
          "maxLength": 200
        }
      }
    },
    "Window": {
      "type": "object",
      "required": [
        "id"
      ],
      "properties": {
        "id": {
          "type": "string",
          "anyOf": [
            {
              "enum": [
                "Morning",
                "Afternoon",
                "Evening"
              ]
            },
            {
              "pattern": "^[a-z0-9][a-z0-9-]*$",
              "maxLength": 40
            }
          ]
        },
        "label": {
          "type": "string",
          "minLength": 1,
          "maxLength": 40
        },
        "start": {
          "$ref": "#/$defs/Time"
        },
        "end": {
          "$ref": "#/$defs/Time"
        }
      },
      "if": {
        "properties": {
          "id": {
            "not": {
              "enum": [
                "Morning",
                "Afternoon",
                "Evening"
              ]
            }
          }
        }
      },
      "then": {
        "required": [
          "id",
          "label",
          "start",
          "end"
        ]
      }
    },
    "BookingPolicy": {
      "type": "object",
      "required": [
        "windows",
        "minimumDaysAhead",
        "weekendRequests",
        "emergencyAvailable",
        "contactMethods"
      ],
      "properties": {
        "windows": {
          "type": "array",
          "minItems": 1,
          "items": {
            "$ref": "#/$defs/Window"
          }
        },
        "minimumDaysAhead": {
          "type": "integer",
          "minimum": 0,
          "maximum": 60
        },
        "maximumDaysAhead": {
          "type": "integer",
          "minimum": 1,
          "maximum": 365,
          "default": 60
        },
        "weekendRequests": {
          "type": "string",
          "enum": [
            "allowed",
            "not_allowed",
            "saturday_only"
          ]
        },
        "emergencyAvailable": {
          "type": "boolean"
        },
        "afterHoursNote": {
          "type": "string",
          "maxLength": 300
        },
        "contactMethods": {
          "type": "array",
          "minItems": 1,
          "uniqueItems": true,
          "items": {
            "$ref": "#/$defs/ContactMethod"
          }
        },
        "requiresAddress": {
          "type": "boolean"
        },
        "vehicleDetailsAccepted": {
          "type": "boolean",
          "default": false
        },
        "confirmationNote": {
          "type": "string",
          "maxLength": 300
        }
      }
    },
    "Interfaces": {
      "type": "object",
      "required": [
        "schedulePageUrl"
      ],
      "properties": {
        "schedulePageUrl": {
          "$ref": "#/$defs/Url"
        },
        "mcp": {
          "type": "object",
          "required": [
            "url",
            "serverCardUrl"
          ],
          "properties": {
            "url": {
              "$ref": "#/$defs/Url"
            },
            "serverCardUrl": {
              "$ref": "#/$defs/Url"
            }
          }
        },
        "rest": {
          "type": "object",
          "required": [
            "baseUrl"
          ],
          "properties": {
            "baseUrl": {
              "$ref": "#/$defs/Url"
            },
            "openApiUrl": {
              "$ref": "#/$defs/Url"
            }
          }
        },
        "webMcp": {
          "type": "boolean"
        },
        "llmsTxtUrl": {
          "$ref": "#/$defs/Url"
        },
        "agentSkillsUrl": {
          "$ref": "#/$defs/Url"
        }
      }
    }
  }
}
